[
  {
    "id": "team_1_fc_koln",
    "sources": {
      "football_data": "1"
    },
    "name": "1. FC Köln",
    "short_name": "KOE",
    "country": "Germany",
    "founded": 1948,
    "logo": "https://crests.football-data.org/1.png"
  },
  {
    "id": "team_tsg_1899_hoffenheim",
    "sources": {
      "football_data": "2"
    },
    "name": "TSG 1899 Hoffenheim",
    "short_name": "TSG",
    "country": "Germany",
    "founded": 1921,
    "logo": "https://crests.football-data.org/2.png"
  },
  {
    "id": "team_bayer_04_leverkusen",
    "sources": {
      "football_data": "3"
    },
    "name": "Bayer 04 Leverkusen",
    "short_name": "B04",
    "country": "Germany",
    "founded": 1904,
    "logo": "https://crests.football-data.org/3.png"
  },
  {
    "id": "team_borussia_dortmund",
    "sources": {
      "football_data": "4"
    },
    "name": "Borussia Dortmund",
    "short_name": "BVB",
    "country": "Germany",
    "founded": 1909,
    "logo": "https://crests.football-data.org/4.png"
  },
  {
    "id": "team_fc_bayern_munchen",
    "sources": {
      "football_data": "5"
    },
    "name": "FC Bayern München",
    "short_name": "FCB",
    "country": "Germany",
    "founded": 1900,
    "logo": "https://crests.football-data.org/5.png"
  },
  {
    "id": "team_fc_schalke_04",
    "sources": {
      "football_data": "6"
    },
    "name": "FC Schalke 04",
    "short_name": "S04",
    "country": "Germany",
    "founded": 1904,
    "logo": "https://crests.football-data.org/6.png"
  },
  {
    "id": "team_hamburger_sv",
    "sources": {
      "football_data": "7"
    },
    "name": "Hamburger SV",
    "short_name": "HSV",
    "country": "Germany",
    "founded": 1887,
    "logo": "https://crests.football-data.org/7.png"
  },
  {
    "id": "team_vfb_stuttgart",
    "sources": {
      "football_data": "10"
    },
    "name": "VfB Stuttgart",
    "short_name": "VFB",
    "country": "Germany",
    "founded": 1893,
    "logo": "https://crests.football-data.org/10.png"
  },
  {
    "id": "team_sv_werder_bremen",
    "sources": {
      "football_data": "12"
    },
    "name": "SV Werder Bremen",
    "short_name": "SVW",
    "country": "Germany",
    "founded": 1899,
    "logo": "https://crests.football-data.org/12.png"
  },
  {
    "id": "team_1_fsv_mainz_05",
    "sources": {
      "football_data": "15"
    },
    "name": "1. FSV Mainz 05",
    "short_name": "M05",
    "country": "Germany",
    "founded": 1905,
    "logo": "https://crests.football-data.org/15.png"
  },
  {
    "id": "team_fc_augsburg",
    "sources": {
      "football_data": "16"
    },
    "name": "FC Augsburg",
    "short_name": "FCA",
    "country": "Germany",
    "founded": 1907,
    "logo": "https://crests.football-data.org/16.png"
  },
  {
    "id": "team_sc_freiburg",
    "sources": {
      "football_data": "17"
    },
    "name": "SC Freiburg",
    "short_name": "SCF",
    "country": "Germany",
    "founded": 1912,
    "logo": "https://crests.football-data.org/17.png"
  },
  {
    "id": "team_borussia_monchengladbach",
    "sources": {
      "football_data": "18"
    },
    "name": "Borussia Mönchengladbach",
    "short_name": "BMG",
    "country": "Germany",
    "founded": 1900,
    "logo": "https://crests.football-data.org/18.png"
  },
  {
    "id": "team_eintracht_frankfurt",
    "sources": {
      "football_data": "19"
    },
    "name": "Eintracht Frankfurt",
    "short_name": "SGE",
    "country": "Germany",
    "founded": 1899,
    "logo": "https://crests.football-data.org/19.png"
  },
  {
    "id": "team_1_fc_union_berlin",
    "sources": {
      "football_data": "28"
    },
    "name": "1. FC Union Berlin",
    "short_name": "UNB",
    "country": "Germany",
    "founded": 1906,
    "logo": "https://crests.football-data.org/28.png"
  },
  {
    "id": "team_sc_paderborn_07",
    "sources": {
      "football_data": "29"
    },
    "name": "SC Paderborn 07",
    "short_name": "SCP",
    "country": "Germany",
    "founded": 1985,
    "logo": "https://crests.football-data.org/29.png"
  },
  {
    "id": "team_sv_07_elversberg",
    "sources": {
      "football_data": "719"
    },
    "name": "SV 07 Elversberg",
    "short_name": "ELV",
    "country": "Germany",
    "founded": 1907,
    "logo": "https://crests.football-data.org/719.png"
  },
  {
    "id": "team_rb_leipzig",
    "sources": {
      "football_data": "721"
    },
    "name": "RB Leipzig",
    "short_name": "RBL",
    "country": "Germany",
    "founded": 2009,
    "logo": "https://crests.football-data.org/721.png"
  },
  {
    "id": "team_arsenal_fc",
    "sources": {
      "football_data": "57"
    },
    "name": "Arsenal FC",
    "short_name": "ARS",
    "country": "England",
    "founded": 1886,
    "logo": "https://crests.football-data.org/57.png"
  },
  {
    "id": "team_aston_villa_fc",
    "sources": {
      "football_data": "58"
    },
    "name": "Aston Villa FC",
    "short_name": "AVL",
    "country": "England",
    "founded": 1872,
    "logo": "https://crests.football-data.org/58.png"
  },
  {
    "id": "team_liverpool_fc",
    "sources": {
      "football_data": "64"
    },
    "name": "Liverpool FC",
    "short_name": "LIV",
    "country": "England",
    "founded": 1892,
    "logo": "https://crests.football-data.org/64.png"
  },
  {
    "id": "team_manchester_city_fc",
    "sources": {
      "football_data": "65"
    },
    "name": "Manchester City FC",
    "short_name": "MCI",
    "country": "England",
    "founded": 1880,
    "logo": "https://crests.football-data.org/65.png"
  },
  {
    "id": "team_manchester_united",
    "sources": {
      "football_data": "66"
    },
    "name": "Manchester United FC",
    "short_name": "MUN",
    "country": "England",
    "founded": 1878,
    "logo": "https://crests.football-data.org/66.png"
  },
  {
    "id": "team_club_atletico_de_madrid",
    "sources": {
      "football_data": "78"
    },
    "name": "Club Atlético de Madrid",
    "short_name": "ATL",
    "country": "Spain",
    "founded": 1903,
    "logo": "https://crests.football-data.org/78.png"
  },
  {
    "id": "team_barcelona",
    "sources": {
      "football_data": "81"
    },
    "name": "FC Barcelona",
    "short_name": "FCB",
    "country": "Spain",
    "founded": 1899,
    "logo": "https://crests.football-data.org/81.png"
  },
  {
    "id": "team_real_madrid",
    "sources": {
      "football_data": "86"
    },
    "name": "Real Madrid CF",
    "short_name": "RMA",
    "country": "Spain",
    "founded": 1902,
    "logo": "https://crests.football-data.org/86.png"
  },
  {
    "id": "team_real_betis_balompie",
    "sources": {
      "football_data": "90"
    },
    "name": "Real Betis Balompié",
    "short_name": "BET",
    "country": "Spain",
    "founded": 1907,
    "logo": "https://crests.football-data.org/90.png"
  },
  {
    "id": "team_villarreal_cf",
    "sources": {
      "football_data": "94"
    },
    "name": "Villarreal CF",
    "short_name": "VIL",
    "country": "Spain",
    "founded": 1923,
    "logo": "https://crests.football-data.org/94.png"
  },
  {
    "id": "team_as_roma",
    "sources": {
      "football_data": "100"
    },
    "name": "AS Roma",
    "short_name": "ROM",
    "country": "Italy",
    "founded": 1927,
    "logo": "https://crests.football-data.org/100.png"
  },
  {
    "id": "team_fc_internazionale_milano",
    "sources": {
      "football_data": "108"
    },
    "name": "FC Internazionale Milano",
    "short_name": "INT",
    "country": "Italy",
    "founded": 1908,
    "logo": "https://crests.football-data.org/108.png"
  },
  {
    "id": "team_ssc_napoli",
    "sources": {
      "football_data": "113"
    },
    "name": "SSC Napoli",
    "short_name": "NAP",
    "country": "Italy",
    "founded": 1904,
    "logo": "https://crests.football-data.org/113.png"
  },
  {
    "id": "team_sporting_clube_de_portugal",
    "sources": {
      "football_data": "498"
    },
    "name": "Sporting Clube de Portugal",
    "short_name": "SPO",
    "country": "Portugal",
    "founded": 1906,
    "logo": "https://crests.football-data.org/498.png"
  },
  {
    "id": "team_fc_porto",
    "sources": {
      "football_data": "503"
    },
    "name": "FC Porto",
    "short_name": "FCP",
    "country": "Portugal",
    "founded": 1893,
    "logo": "https://crests.football-data.org/503.png"
  },
  {
    "id": "team_lille_osc",
    "sources": {
      "football_data": "521"
    },
    "name": "Lille OSC",
    "short_name": "LIL",
    "country": "France",
    "founded": 1944,
    "logo": "https://crests.football-data.org/521.png"
  },
  {
    "id": "team_paris_saint_germain_fc",
    "sources": {
      "football_data": "524"
    },
    "name": "Paris Saint-Germain FC",
    "short_name": "PSG",
    "country": "France",
    "founded": 1904,
    "logo": "https://crests.football-data.org/524.png"
  },
  {
    "id": "team_racing_club_de_lens",
    "sources": {
      "football_data": "546"
    },
    "name": "Racing Club de Lens",
    "short_name": "RCL",
    "country": "France",
    "founded": 1906,
    "logo": "https://crests.football-data.org/546.png"
  },
  {
    "id": "team_galatasaray_sk",
    "sources": {
      "football_data": "610"
    },
    "name": "Galatasaray SK",
    "short_name": "GAL",
    "country": "Turkey",
    "founded": 1905,
    "logo": "https://crests.football-data.org/610.png"
  },
  {
    "id": "team_fenerbahce_sk",
    "sources": {
      "football_data": "613"
    },
    "name": "Fenerbahçe SK",
    "short_name": "FEN",
    "country": "Turkey",
    "founded": 1907,
    "logo": "https://crests.football-data.org/613.png"
  },
  {
    "id": "team_psv",
    "sources": {
      "football_data": "674"
    },
    "name": "PSV",
    "short_name": "PSV",
    "country": "Netherlands",
    "founded": 1913,
    "logo": "https://crests.football-data.org/674.png"
  },
  {
    "id": "team_feyenoord_rotterdam",
    "sources": {
      "football_data": "675"
    },
    "name": "Feyenoord Rotterdam",
    "short_name": "FEY",
    "country": "Netherlands",